{
  "schemaVersion": "1.0.0",
  "workflow": {
    "id": "sample_workflow",
    "name": "Sample Workflow"
  },
  "state": {
    "finally_ran": {
      "type": {
        "name": "boolean"
      }
    },
    "last_item": {
      "type": {
        "name": "string"
      }
    }
  },
  "body": {
    "id": "root",
    "kind": "sequence",
    "statements": [
      {
        "id": "fs_list",
        "kind": "callBlock",
        "block": "fs.list",
        "inputs": {
          "path": {
            "kind": "literal",
            "value": ""
          },
          "recursive": {
            "kind": "literal",
            "value": false
          }
        }
      },
      {
        "id": "return_outputs",
        "kind": "return",
        "returns": {
          "finally_ran": {
            "kind": "ref",
            "ref": "state.finally_ran"
          },
          "last_item": {
            "kind": "ref",
            "ref": "state.last_item"
          }
        }
      }
    ]
  }
}
