{
  "schemaVersion": "1.0.0",
  "workflow": {
    "id": "valid_v1_workflow"
  },
  "state": {
    "x": {
      "type": {
        "name": "string"
      }
    }
  },
  "workflows": [
    {
      "id": "child",
      "body": {
        "id": "child_return",
        "kind": "return",
        "returns": {}
      }
    }
  ],
  "body": {
    "id": "root",
    "kind": "sequence",
    "statements": [
      {
        "id": "assign",
        "kind": "assign",
        "target": "state.x",
        "value": {
          "kind": "literal",
          "value": "ok"
        }
      },
      {
        "id": "call_child",
        "kind": "callWorkflow",
        "workflow": "child",
        "inputs": {}
      },
      {
        "id": "return",
        "kind": "return",
        "returns": {
          "x": {
            "kind": "ref",
            "ref": "state.x"
          }
        }
      }
    ]
  }
}
